{
  "schema_version": "1.0",
  "profile": "team-standard",
  "local_green": {
    "environment": {
      "GIT_CONFIG_COUNT": "1",
      "GIT_CONFIG_KEY_0": "core.abbrev",
      "GIT_CONFIG_VALUE_0": "40",
      "PYTHONDONTWRITEBYTECODE": "1"
    },
    "commands": [
      ["sddgov", "doctor", "."],
      ["sddgov", "ci", "verify", "."],
      ["python", "scripts/readme_command_smoke.py"],
      ["python", "scripts/check_release_parity.py"],
      ["python", "scripts/run_subject_identity_test_isolation.py"],
      [
        "python",
        "-m",
        "pytest",
        "-q",
        "--ignore=tests/test_subject_authorization_bootstrap.py",
        "--ignore=tests/test_subject_authorization_runner.py",
        "--ignore=tests/test_subject_progress_v2.py",
        "--ignore=tests/test_subject_progress_v3.py",
        "--ignore=tests/test_subject_task_authorization_v2.py",
        "--ignore=tests/test_subject_task_authorization_v3.py",
        "--ignore=tests/test_subject_progress.py",
        "--ignore=tests/test_subject_task_authorization_dispatch.py",
        "--ignore=tests/test_subject_development_mission_v4.py",
        "--ignore=tests/test_subject_task_authorization_dispatch_v4.py"
      ]
    ]
  },
  "hosted": {
    "max_runs_per_work_package": 1,
    "max_reruns_per_revision": 1,
    "expected_minutes": 20,
    "full_matrix": "manual_or_ready_for_review"
  },
  "workflow_controls": {
    "require_concurrency": true,
    "cancel_in_progress": true,
    "require_job_timeouts": true,
    "require_read_only_permissions": true,
    "skip_draft_pull_requests": true,
    "exempt_workflows": [
      "pages.yml",
      "publish.yml"
    ]
  }
}
